[
  {
    "id": "TC-LOGIN-001",
    "title": "有效凭据登录",
    "description": "验证已注册用户使用正确的用户名和密码可以成功登录系统",
    "steps": ["打开登录页面", "输入有效用户名 'testuser'", "输入有效密码", "点击登录按钮"],
    "expected_result": "页面跳转到首页，导航栏显示用户名 'testuser'，返回200状态码",
    "priority": "high",
    "tags": ["登录", "冒烟测试", "核心流程"]
  },
  {
    "id": "TC-LOGIN-002",
    "title": "无效凭据登录",
    "description": "验证使用错误的密码时系统拒绝登录并给出正确提示",
    "steps": ["打开登录页面", "输入有效用户名 'testuser'", "输入无效密码 'wrong'", "点击登录按钮"],
    "expected_result": "停留在登录页面，显示错误提示'用户名或密码错误'，不泄露具体哪个字段出错",
    "priority": "high",
    "tags": ["登录", "安全", "异常处理"]
  },
  {
    "id": "TC-LOGIN-003",
    "title": "空凭据登录",
    "description": "验证用户名或密码为空时系统给出前端校验提示",
    "steps": ["打开登录页面", "用户名和密码留空", "点击登录按钮"],
    "expected_result": "不发送请求，前端显示'请输入用户名'和'请输入密码'的校验提示",
    "priority": "medium",
    "tags": ["登录", "前端校验", "边界测试"]
  }
]
